{
  "finding_id": "GHSA-4gp8-rjrq-ch6q",
  "type": "xss.blind",
  "target": {
    "expected_origin": "http://127.0.0.1:8099",
    "allowed_hosts": ["127.0.0.1"],
    "allowed_schemes": ["http"],
    "allowed_ports": [8099]
  },
  "auth": {
    "required": false
  },
  "evidence": {
    "request": {
      "method": "POST",
      "url": "http://127.0.0.1:8099/preview",
      "headers": [
        { "name": "content-type", "value": "application/x-www-form-urlencoded" }
      ],
      "body": "url=placeholder"
    },
    "mutation_slots": {
      "oast_url": "url"
    },
    "payload_marker": "VERIFIER_BLIND_{{nonce}}"
  },
  "proof": {
    "expected_signal": "oast_http",
    "expected_path_contains": "/cb/",
    "poll_window_seconds": 45
  }
}
